ID	Title	URL	Version	Word count	OWE	SPURIOUS	SPECIFIC	LETTER	ROUNDUP	NON-UK EDITION	NON-ENGLISH	VIDEO	NON-DISRUPTIVE OWE	OWE_FOCUSSED	OWE_SPECIFIC_LLM	OWE_SPECIFIC_HUMAN	PASSES_SCREENING	PASSES_SCREENING_SPECIFIC	SUMMARY_CHECK	CORRECTION_INSTRUCTIONS	REPLACED_FIELDS
Metro_None_Teach-Black-History-in	Teach Black History in schools all year round but call it what it is	https://metro.co.uk/2023/10/12/black-history-is-too-vast-to-be-taught-over-just-one-month-19618558/	original	1212	No	Yes	Yes	No	No	No	No	No	No	No	No	Unused	No	No	no_check		
Metro_None_Think-single-mums-need	Think single mums need to work more? Tell me how	https://metro.co.uk/2023/11/06/think-single-mums-need-to-work-more-tell-me-how-19781103/	original	1360	No	Yes	Yes	No	No	No	No	No	No	No	No	Unused	No	No	no_check		
Mirror_None_Glastonbury-Festival-veterans-share	Glastonbury Festival veterans share one item to bring that will save you a fortune	https://www.mirror.co.uk/news/uk-news/glastonbury-festival-veterans-share-one-35066946	original	619	No	Yes	No	No	No	No	No	No	No	No	No	Unused	No	No	no_check		
Sun_2023-10-20_GHOUL-GOT-LUCKY-Tories	GHOUL 'GOT LUCKY' Tories hit out at election of eco zombie Alistair Strathern to Mid Bedfordshire seat	https://www.thesun.co.uk/news/24475183/tories-election-eco-zombie-alistair-strathern-mid-bedfordshire-seat/	original	221	Yes	No	Yes	No	No	No	No	No	No	Yes	No	Not even owe	Yes	No	no_check		
Metro_None_Man-stole-so-much	Man stole so much electricity from neighbours their young daughter had to get a job	https://metro.co.uk/2024/07/18/man-fitted-secret-device-neighbours-meter-steal-4-000-electricity-21249041/	original	692	No	Yes	No	No	No	No	No	No	No	No	No	Unused	No	No	no_check		
Sky_2024-07-01_Deafening-silence-on	'Deafening silence' on climate change criticised by CBI, which says being pro-growth means being pro-green	https://news.sky.com/story/deafening-silence-on-climate-change-criticised-by-cbi-which-says-being-pro-growth-means-being-pro-green-13161740	original	650	Yes	No	Yes	No	No	No	No	No	No	No	No	Unused	No	No	no_check		
Sun_2025-07-26_TEE-TIME-Donald-Trump	TEE TIME Donald Trump spotted with son Eric at luxury Turnberry resort during five-day Scotland visit	https://www.thesun.co.uk/news/36024092/donald-trump-spotted-son-eric-turnberry-scotland-visit/	original	848	No	No	Yes	No	No	No	No	No	No	No	No	Unused	No	No	no_check		
Sky_2024-12-17_Antiwhaling-activist-Paul-Watson	Anti-whaling activist Paul Watson freed from custody and will not face extradition to Japan	https://news.sky.com/story/anti-whaling-activist-paul-watson-freed-from-custody-and-will-not-face-extradition-to-japan-13275489	original	514	Yes	No	Yes	No	No	No	No	No	No	No	No	Unused	No	No	no_check		
BBC_2024-02-26_Climate-protesters-guilty-of	Climate protesters guilty of trespass at Wimbledon	https://www.bbc.com/news/articles/cn3n3x8gx2po	original	536	Yes	No	Yes	No	No	No	No	No	No	Yes	Yes	Owe specific	Yes	Yes	pass		
Mirror_2024-02-28_BBC-Winterwatchs-Chris-Packham	BBC Winterwatch's Chris Packham admits home attacks have changed stepdaughter star's life	https://www.mirror.co.uk/3am/celebrity-news/bbc-winterwatchs-chris-packham-shares-32234101	original	659	Yes	No	No	No	No	No	No	No	No	No	No	Unused	No	No	no_check		
Sky_2023-11-11_Hundreds-of-thousands	Hundreds of thousands to join pro-Palestinian march in London - as Cenotaph guarded	https://news.sky.com/story/hundreds-of-thousands-to-join-pro-palestine-march-in-london-as-cenotaph-to-be-guarded-13004796	original	1325	No	Yes	No	No	No	No	No	No	No	No	No	Unused	No	No	no_check		
The-Times_2023-10-11_Labour-fury-at-security	Labour fury at security lapses over Keir Starmer glitter protester	https://www.thetimes.com/uk/politics/article/keir-starmer-speech-labour-glitter-protester-6vwxtlg2m	original	1656	Yes	No	Yes	No	No	No	No	No	No	Yes	Yes	Not even owe	Yes	No	no_check		
The-Times_2025-01-02_Gold-rush-for-Glastonbury	Gold rush for Glastonbury despite Neil Young’s cancellation	https://www.thetimes.com/uk/arts/article/neil-young-glastonbury-2025-corporate-turn-off-f272996k6	original	650	No	No	No	No	No	No	No	No	No	No	No	Unused	No	No	no_check		
The-Times_2024-02-16_As-the-air-goes	As the air goes out of Just Stop Oil, new tyre deflaters hit the streets	https://www.thetimes.com/uk/article/as-the-air-goes-out-of-just-stop-oil-new-tyre-deflaters-hit-the-streets-pv7s6qjvc	original	1635	Yes	No	Yes	No	No	No	No	No	No	Yes	No	Owe specific	Yes	Yes	consistency_issue The summary significantly alters the tone and balance of the original article regarding the Tyre Extinguishers protest action. The original article presents a more balanced view that includes both the protesters' perspective (calling SUVs "polluting death machines") and substantial negative impacts on victims like Knowles, including her full quote expressing fear and distress: "I'm looking out the window at night just to see if they're outside. I don't want anyone near my vehicle. They could put the wrong thing in there, they could flatten it for all I know… They don't know why people need a vehicle." The summary truncates this quote, removing the more emotionally impactful portions about her fear and the protesters' lack of understanding of people's vehicle needs. Additionally, the original provides important context about Knowles using the vehicle through her disabled father's mobility allowance and explains that she didn't display her disabled badge, making her a target despite the group's policy not to target mobility vehicles. The summary omits these crucial details that help explain the problematic nature of the targeting, thus shifting the balance away from showing the negative consequences of the protest action.		
BBC_2024-08-01_Just-Stop-Oil-activists	Just Stop Oil activists jailed after M25 blocked	https://www.bbc.com/news/articles/cgxqwwev50ko	original	467	Yes	No	Yes	No	No	No	No	No	No	Yes	Yes	Owe specific	Yes	Yes	pass		
BBC_2024-06-07_Paint-sprayed-in-air	Paint sprayed in air outside duke's wedding	https://www.bbc.com/news/articles/cd11k50vy95o	original	137	Yes	No	Yes	No	No	No	No	No	No	Yes	Yes	Owe but fails other criteria	Yes	No	no_check		
The-Times_2025-06-19_Boost-for-North-Sea	Boost for North Sea drilling as Ed Miliband rewrites green rules	https://www.thetimes.com/uk/politics/article/miliband-to-rewrite-green-rules-to-allow-north-sea-drilling-8g2tdvgqx	original	723	Yes	No	Yes	No	No	No	No	No	No	No	No	Unused	No	No	no_check		
Mirror_2024-07-19_Nadia-Sawalha-admits-Im	Nadia Sawalha admits 'I'm not very good at this' as she's forced to host Loose Women	https://www.mirror.co.uk/tv/tv-news/nadia-sawalha-admits-im-not-33282012	original	415	Yes	No	Yes	No	No	No	No	No	No	No	No	Unused	No	No	no_check		
BBC_2024-09-25_Oh-Keir--Why	'Oh Keir' - Why a giant Nessa mural appeared on a beach	https://www.bbc.com/news/articles/c0e1l0ppqx7o	original	307	Yes	No	Yes	No	No	No	No	No	No	No	No	Unused	No	No	no_check		
Mirror_2024-05-03_Just-Stop-Oil-protesters	Just Stop Oil protesters to chill on yoga trip as they plan summer airport chaos	https://www.mirror.co.uk/news/uk-news/just-stop-oil-protesters-chill-32733044	original	318	Yes	No	Yes	No	No	No	No	No	No	Yes	Yes	Owe unspecific	Yes	No	no_check		
Metro_None_I-was-at-the	I was at the Big Brother live launch – here’s what you didn’t see, including the Henry moment that left me baffled	https://metro.co.uk/2023/10/09/i-was-at-the-big-brother-live-launch-heres-what-you-didnt-see-19632481/	original	1322	No	Yes	No	No	No	No	No	No	No	No	No	Unused	No	No	no_check		
Sky_2024-07-25_Over-100-flights	Over 100 flights cancelled after protesters glue themselves to runway at Frankfurt Airport	https://news.sky.com/story/over-100-flights-cancelled-after-protesters-glue-themselves-to-runway-at-frankfurt-airport-13184717	original	374	Yes	No	Yes	No	No	No	No	No	No	Yes	Yes	Owe specific	Yes	Yes	pass		
Sky_2024-09-20_Judge-throws-out	Judge throws out charges against Greenpeace activists who scaled Sunak's home	https://news.sky.com/story/judge-throws-out-charges-against-greenpeace-activists-who-scaled-sunaks-home-13218527	original	461	Yes	No	Yes	No	No	No	No	No	No	Yes	Yes	Owe specific	Yes	Yes	pass		
Sun_2025-06-02_MACGONE-Greenpeace-activists-swipe	MAC-GONE Greenpeace activists swipe Emmanuel Macron waxwork from Paris’s Grevin Museum before using it in anti-Russia protest	https://www.thesun.co.uk/news/35230124/greenpeace-emmanuel-macron-waxwork-russia/	original	256	Yes	No	Yes	No	No	No	No	No	No	No	Yes	Unused	No	No	no_check		
Mirror_2024-06-24_PGA-Tour-star-tackled	PGA Tour star tackled by security guard makes 18-word statement on protestor chaos	https://www.mirror.co.uk/sport/golf/travelers-championship-extinction-rebellion-pga-33092708	original	523	Yes	No	Yes	No	No	No	No	No	No	No	No	Unused	No	No	no_check		
Metro_None_Just-Stop-Oil-cover	Just Stop Oil cover planes in paint ‘hours after Taylor Swift’s private jet arrived’	https://metro.co.uk/2024/06/20/just-stop-oil-paint-planes-hours-taylor-swifts-private-jet-arrived-21068979/	original	559	Yes	No	Yes	No	No	No	No	No	No	Yes	Yes	Owe specific	Yes	Yes	pass		
Mirror_2024-04-20_Thousands-of-summer-holidays	Thousands of summer holidays at risk as Just Stop Oil plot to cause havoc at airports	https://www.mirror.co.uk/news/uk-news/thousands-summer-holidays-risk-just-32634226	original	780	Yes	No	Yes	No	No	No	No	No	No	Yes	Yes	Owe specific	Yes	Yes	pass		
ITV_2024-09-30_Three-Just-Stop	Three Just Stop Oil activists deny ‘revenge’ soup attack on Van Gogh paintings at National Gallery	https://www.itv.com/news/london/2024-09-30/just-stop-oil-activists-deny-revenge-soup-attack-on-van-gogh-paintings	original	488	Yes	No	Yes	No	No	No	No	No	No	Yes	Yes	Owe specific	Yes	Yes	consistency_issue The summary omits crucial context that explains the timing and motivation of the protest. The original article emphasizes that this soup attack occurred "hours after other activists were jailed" and provides detailed background about the previous sentencing of Phoebe Plummer and Anna Holland for a similar attack in October 2022. This context is essential to understanding why the incident is characterized as a potential "revenge" attack (as indicated in the title). By removing this background information, the summary significantly changes the portrayal of the protest from one that appears to be a reactive response to the jailing of fellow activists to an isolated incident, thus failing to maintain the original article's framing and context.		
The-Times_2025-08-08_A-history-of-Palestine	A history of Palestine Action: from birth to ban	https://www.thetimes.com/uk/crime/article/a-history-of-palestine-action-from-birth-to-ban-zjmbnvzp8	original	1960	No	No	Yes	No	No	No	No	No	No	No	No	Unused	No	No	no_check		
Metro_None_Greta-Thunberg-arrested-and	Greta Thunberg arrested and handcuffed at Pro-Palestine protest	https://metro.co.uk/2024/09/04/greta-thunberg-arrested-handcuffed-pro-palestine-protest-21544513/	original	472	No	No	Yes	No	No	No	No	No	No	No	No	Unused	No	No	no_check		
Metro_None_Kim-Kardashians-new-nipple	Kim Kardashian’s new nipple bra slammed for ‘greenwashing’	https://metro.co.uk/2023/11/19/kim-kardashian-nipple-bra-making-mockery-climate-change-19845662/	original	535	No	No	No	No	No	No	No	No	No	No	No	Unused	No	No	no_check		
The-Times_2025-07-25_Turnberry-locals-on-Trump	Turnberry locals on Trump: We love ‘Big Donald’ and his $50 tips	https://www.thetimes.com/uk/politics/article/turnberry-golf-course-scotland-trump-g85xd857z	original	950	Yes	No	Yes	No	No	No	No	No	No	No	No	Unused	No	No	no_check		
Metro_None_Its-hyperconsumerism-fuelling-this	‘It’s hyper-consumerism fuelling this plague on the youth’s mental health’	https://metro.co.uk/2025/04/01/its-hyper-consumerism-fuelling-this-plague-youths-mental-health-22831320/	original	642	Yes	No	Yes	Yes	No	No	No	No	No	No	No	Unused	No	No	no_check		
Metro_None_My-mum-called-me	My mum called me bridezilla and said my friends were complaining about me	https://metro.co.uk/2024/01/07/called-a-bridezilla-dont-think-im-asking-much-20034512/	original	1284	No	Yes	No	No	No	No	No	No	No	No	No	Unused	No	No	no_check		
Metro_None_Why-are-decent-people	Why are decent people afraid to talk about trans rights?	https://metro.co.uk/2023/10/31/why-are-decent-people-afraid-to-talk-about-trans-rights-19748801/	original	1094	No	Yes	Yes	No	No	No	No	No	No	No	No	Unused	No	No	no_check		
Metro_None_Heathrow-flights-cancelled-after	Heathrow flights cancelled after rush hour delays at major London station	https://metro.co.uk/2024/07/24/elizabeth-line-delays-hit-trains-londons-paddington-station-latest-21285509/	original	2051	Yes	No	Yes	No	Yes	No	No	No	No	No	No	Unused	No	No	no_check		
Metro_None_Weve-been-together-23	We’ve been together 23 years – here’s the secret to our happiness	https://metro.co.uk/2023/11/30/happily-married-23-years-secret-success-19905644/	original	1338	No	Yes	No	No	No	No	No	No	No	No	No	Unused	No	No	no_check		
BBC_2024-02-24_Rochdale-Is-this-the	Rochdale: Is this the most chaotic by-election ever?	https://www.bbc.com/news/uk-politics-68375450	original	1766	No	No	Yes	No	No	No	No	No	No	No	No	Unused	No	No	no_check		
Metro_None_Kim-Kardashian-has-done	Kim Kardashian has done wonders for male nannies like me	https://metro.co.uk/2023/10/19/im-a-male-nanny-my-gender-doesnt-make-me-any-less-good-at-my-job-18165150/	original	1584	No	Yes	No	No	No	No	No	No	No	No	No	Unused	No	No	no_check		
The-Times_2025-03-10_The-Weather-Station-review	The Weather Station review — dark, stormy and ultimately uplifting	https://www.thetimes.com/culture/music/article/the-weather-station-review-glasgow-gshzscgvl	original	391	No	No	No	No	No	No	No	No	No	No	No	Unused	No	No	no_check		
BBC_2024-02-08_All-the-candidates-in	All the candidates in the Rochdale by-election	https://www.bbc.com/articles/cq57ggp15z9o	original	1523	Yes	No	Yes	No	No	No	No	No	No	No	No	Unused	No	No	no_check		
Metro_None_I-put-on-lingerie	I put on lingerie as a present for my lover and learned never to give sex as a gift	https://metro.co.uk/2023/12/22/put-lingerie-a-present-lover-learned-not-give-sex-gifts-20001895/	original	1443	No	Yes	No	No	No	No	No	No	No	No	No	Unused	No	No	no_check		
Metro_None_Ive-given-up-trying	I’ve given up trying to cure my mental illness and it’s done wonders for my wellbeing	https://metro.co.uk/2023/10/10/accepting-my-mental-illness-has-done-wonders-for-my-wellbeing-19631329/	original	1508	No	Yes	No	No	No	No	No	No	No	No	No	Unused	No	No	no_check		
Sun_2023-11-09_READY-TO-TAKE-OFF	READY TO TAKE OFF WH Smith set to expand with more shops and bigger sales in US airports as it is ‘taking over in America’	https://www.thesun.co.uk/money/24688765/wh-smith-expand-shops-sales-us-airports-america/	original	939	Yes	No	Yes	No	Yes	No	No	No	No	No	No	Unused	No	No	no_check		
BBC_2024-09-23_Scrap-law-making-schools	Scrap law making schools serve meat, urges Labour donor	https://www.bbc.com/news/articles/crejwrypryyo	original	417	No	No	No	No	No	No	No	No	No	No	No	Unused	No	No	no_check		
BBC_2025-08-01_Heathrow-Airports-expansion-plans	Heathrow Airport's expansion plans to cost £49bn	https://www.bbc.com/news/articles/cj6yz77nlw4o	original	1299	No	No	No	No	No	No	No	No	No	No	No	Unused	No	No	no_check		
BBC_2024-06-20_Key-oil-project-must	Key oil project must count full climate impact - court	https://www.bbc.com/news/articles/cxwwzmn12g9o	original	652	No	No	Yes	No	No	No	No	No	Yes	No	No	Unused	No	No	no_check		
Metro_None_Heathrow-flights-cancelled-as	Heathrow flights cancelled as M25 crash and A38 spillage spark major delays	https://metro.co.uk/2024/07/25/heathrow-flights-cancelled-m25-delays-spark-rush-hour-traffic-jam-21293665/	original	1585	Yes	No	Yes	No	Yes	No	No	No	No	No	No	Unused	No	No	no_check		
Metro_None_I-used-to-think	I used to think porn wasn’t for women – now I’m hooked	https://metro.co.uk/2024/01/05/used-think-porn-wasnt-women-now-im-hooked-20070805/	original	1403	No	Yes	No	No	No	No	No	No	No	No	No	Unused	No	No	no_check		
Metro_None_The-UK-is-racist	The UK is racist – Rishi Sunak’s skin colour doesn’t prove otherwise	https://metro.co.uk/2023/10/05/the-uk-is-racist-rishi-sunaks-skin-colour-doesnt-prove-otherwise-19610540/	original	1023	No	Yes	Yes	No	No	No	No	No	No	No	No	Unused	No	No	no_check		
BBC_2024-08-19_London-City-Airport-passenger	London City Airport passenger cap to rise by 2.5m	https://www.bbc.com/news/articles/clyw80v45jeo	original	520	No	No	No	No	No	No	No	No	No	No	No	Unused	No	No	no_check		
Metro_None_Just-Stop-Oil-protesters	Just Stop Oil protesters arrested at Heathrow as flights cancelled at airports	https://metro.co.uk/2024/08/01/heathrow-gatwick-cancel-flights-rac-issues-driving-warning-weather-21339342/	original	1185	Yes	No	Yes	No	Yes	No	No	No	No	No	No	Unused	No	No	no_check		
BBC_2024-02-02_Greta-Thunberg-cleared-after	Greta Thunberg cleared after unlawful protest arrest	https://www.bbc.com/news/uk-england-london-68180317	original	568	Yes	No	Yes	No	No	No	No	No	No	No	Yes	Unused	No	No	no_check		
BBC_2025-07-25_Forth-Road-Bridge-closed	Forth Road Bridge closed after Greenpeace protest	https://www.bbc.com/news/articles/cp868llxlnxo	original	563	Yes	No	Yes	No	No	No	No	No	No	Yes	Yes	Owe specific	Yes	Yes	pass		
BBC_2024-10-03_The-mind-bomb-photos	The 'mind bomb' photos that led to a global whaling ban	https://www.bbc.com/future/article/20241002-how-greenpeaces-mindbomb-photos-stopped-the-commercial-whaling-industry	original	1187	Yes	No	Yes	No	No	No	No	No	No	Yes	No	Owe unspecific	Yes	No	no_check		
BBC_2023-12-18_Extinction-Rebellion-cofounder-Gail	Extinction Rebellion co-founder Gail Bradbrook sentenced	https://www.bbc.com/news/uk-england-london-67750538	original	591	Yes	No	Yes	No	No	No	No	No	No	Yes	Yes	Owe specific	Yes	Yes	pass		
Metro_None_Four-arrested-after-protester	Four arrested after protester takes a dump in Rishi Sunak’s back garden	https://metro.co.uk/2024/06/25/protester-breaks-rishi-sunaks-garden-takes-a-dump-duck-pond-21102658/	original	701	Yes	No	Yes	No	No	No	No	No	No	Yes	Yes	Owe specific	Yes	Yes	pass		
BBC_2024-06-29_Third-arrest-after-Stonehenge	Third arrest after Stonehenge sprayed with powder paint	https://www.bbc.com/news/articles/c7249jrgrv0o	original	215	Yes	No	Yes	No	No	No	No	No	No	Yes	Yes	Owe specific	Yes	Yes	no_check		
BBC_2024-07-26_Ten-climate-activists-charged	Ten climate activists charged after Heathrow protest	https://www.bbc.com/news/articles/c3g6yegr0yjo	original	205	Yes	No	Yes	No	No	No	No	No	No	Yes	Yes	Owe specific	Yes	Yes	no_check		
The-Times_2024-01-22_Beware-the-wave-of	Beware the wave of radical, activist OAPs	https://www.thetimes.com/comment/columnists/article/beware-the-wave-of-radical-activist-oaps-jl2nsxhmp	original	896	Yes	No	Yes	No	No	No	No	No	No	No	No	Unused	No	No	no_check		
The-Times_2024-07-27_Mum-got-four-years	Mum got four years for renting a safehouse for Just Stop Oil	https://www.thetimes.com/uk/environment/article/mum-safehouse-just-stop-oil-jso-c8q2vb8q8	original	1171	Yes	No	Yes	No	No	No	No	No	No	Yes	Yes	Owe specific	Yes	Yes	consistency_issue The summary fails the consistency check by significantly altering the tone and balance of the original article. The original article presents a sympathetic, humanizing portrait of Louise Lancaster through extensive quotes from her family members who describe her as "unrelentingly kind," someone who "listens more than she speaks," and a "sensitive soul" who struggled with the decision to inconvenience people. The family's perspective dominates the original, explaining her careful reasoning process, her previous attempts at conventional activism, and the personal costs she has endured. In contrast, the summary strips away almost all of this humanizing context and family perspective, instead leading with and emphasizing the judge's characterization of Lancaster and others as having "crossed the line from concerned campaigner to fanatic." The summary focuses primarily on the disruption caused and the legal proceedings, while relegating the family's supportive view to just a brief mention in the subtitle. This fundamentally changes the article's tone from sympathetic and family-focused to more prosecution-focused, failing to maintain the original's balance between the disruptive effects and the personal story of why Lancaster felt compelled to act.	The summary alters the tone and balance of the original article. The original article presents a sympathetic, humanizing portrait of Louise Lancaster through extensive quotes from her family members who describe her as "unrelentingly kind," and as someone who "listens more than she speaks" and who struggled with the decision to inconvenience people. The family's perspective dominates the original, explaining her careful reasoning process, her previous attempts at conventional activism, and the personal costs she has endured. In contrast, the summary strips away almost all of this humanizing context and family perspective, instead leading with and emphasizing the judge's characterization of Lancaster and others as having "crossed the line from concerned campaigner to fanatic." The summary focuses primarily on the disruption caused and the legal proceedings, while relegating the family's supportive view to just a brief mention in the subtitle. The key aspects of the protest itself must be covered, but not at the expense of losing changing the article's tone which is sympathetic, family-focused, and includes the personal story of why Lancaster felt compelled to act.	
BBC_2024-06-07_William-among-guests-at	William among guests at Duke of Westminster's wedding	https://www.bbc.com/news/articles/c3ggpwx27ydo	original	799	Yes	No	Yes	No	No	No	No	No	No	No	No	Unused	No	No	no_check		
BBC_None_Ronnie-OSullivan-Masters-winner	Ronnie O'Sullivan: Masters winner responds angrily after being criticised by Ali Carter	https://www.bbc.com/sport/snooker/67988328	original	704	No	No	Yes	No	No	No	No	No	No	No	No	Unused	No	No	no_check		
Metro_None_Hollywood-actress-slams-Jeff	Hollywood actress slams Jeff Bezos’ star-studded wedding in brutal speech	https://metro.co.uk/2025/06/30/hollywood-actress-slams-jeff-bezos-star-studded-wedding-brutal-speech-23541492/	original	736	No	No	Yes	No	No	No	No	No	No	No	No	Unused	No	No	no_check		
Metro_None_Youll-never-catch-me	You’ll never catch me asking my parents to babysit – I want them to enjoy life	https://metro.co.uk/2024/01/14/dont-expect-parents-babysit-think-selfish-ask-20092550/	original	1305	No	Yes	No	No	No	No	No	No	No	No	No	Unused	No	No	no_check		
Metro_None_I-have-a-stammer	I have a stammer but you’d never know – not even my wife did	https://metro.co.uk/2024/01/06/a-stammer-34-years-wife-no-idea-20062169/	original	1294	No	Yes	No	No	No	No	No	No	No	No	No	Unused	No	No	no_check		
BBC_2024-07-26_High-Court-injunction-bans	High Court injunction bans protesters from M25	https://www.bbc.com/news/articles/cqe61zgd065o	original	196	Yes	No	No	No	No	No	No	No	No	Yes	No	Owe unspecific	Yes	No	no_check		
Metro_None_Is-Just-Stop-Oil	Is Just Stop Oil actually over – or is something more extreme on the horizon?	https://metro.co.uk/2025/04/01/just-stop-oil-actually-something-extreme-horizon-22830397/	original	1458	Yes	No	Yes	No	No	No	No	No	No	Yes	No	Owe unspecific	Yes	No	no_check		
BBC_2024-08-05_Just-Stop-Oil-protesters	Just Stop Oil protesters arrested at airport	https://www.bbc.com/news/articles/c05jjj5r4dgo	original	235	Yes	No	No	No	No	No	No	No	No	Yes	Yes	Owe specific	Yes	Yes	no_check		
Metro_None_I-ran-to-escape	I ran to escape the grief of my dad’s killing and didn’t stop for 15 years	https://metro.co.uk/2023/12/30/ran-escape-grief-dads-killing-didnt-stop-15-years-20032467/	original	1388	No	Yes	No	No	No	No	No	No	No	No	No	Unused	No	No	no_check		
BBC_2024-07-18_Two-men-face-trial	Two men face trial over Radcliffe Camera damage	https://www.bbc.com/news/articles/c1rw9z05xzzo	original	166	Yes	No	Yes	No	No	No	No	No	No	Yes	Yes	Owe specific	Yes	Yes	no_check		
BBC_2023-10-10_Radcliffe-Camera-in-Oxford	Radcliffe Camera in Oxford daubed with paint in Just Stop Oil protest	https://www.bbc.com/news/uk-england-oxfordshire-67068249	original	322	Yes	No	Yes	No	No	No	No	No	No	Yes	Yes	Owe specific	Yes	Yes	no_check		
Metro_None_My-dying-daughter-said	‘My dying daughter said goodbyes on Zoom while Tories partied in lockdown’	https://metro.co.uk/2023/10/03/they-broke-the-rules-without-a-care-while-my-daughter-died-in-lockdown-19574577/	original	2011	No	Yes	No	No	No	No	No	No	No	No	No	Unused	No	No	no_check		
Metro_None_A-neighbour-told-me	A neighbour told me they nearly called the police when my toddler had a tantrum	https://metro.co.uk/2023/10/01/a-neighbour-told-me-they-nearly-called-the-police-when-my-toddler-had-a-tantrum-19515656/	original	1337	No	Yes	No	No	No	No	No	No	No	No	No	Unused	No	No	no_check		
BBC_2024-06-21_Two-women-charged-after	Two women charged after jets sprayed with paint	https://www.bbc.com/news/articles/c722p513ld3o	original	240	Yes	No	Yes	No	No	No	No	No	No	Yes	Yes	Owe specific	Yes	Yes	no_check		
BBC_2023-10-25_Bristol-grandma-climbed-M25	Bristol grandma climbed M25 gantry 'in climate emergency protest'	https://www.bbc.com/news/uk-england-bristol-67215367	original	407	Yes	No	Yes	No	No	No	No	No	No	Yes	Yes	Owe specific	Yes	Yes	pass		
Metro_None_Just-Stop-Oil-activists	Just Stop Oil activists disrupt West End performance of Les Miserables	https://metro.co.uk/2023/10/04/just-stop-oil-activists-disrupt-les-mes-performance-by-invading-stage-19607564/	original	584	Yes	No	Yes	No	No	No	No	No	No	Yes	Yes	Owe specific	Yes	Yes	pass		
Metro_None_I-was-5-when	I was 5 when I escaped the housefire that killed my 3-year-old brother	https://metro.co.uk/2023/12/04/survived-a-fire-killed-3-year-old-brother-finally-overcome-guilt-19887368/	original	1428	No	Yes	No	No	No	No	No	No	No	No	No	Unused	No	No	no_check		
BBC_2023-10-12_Just-Stop-Oil-protesters	Just Stop Oil protesters bid to challenge jail terms refused	https://www.bbc.com/news/uk-england-essex-67079796	original	399	Yes	No	Yes	No	No	No	No	No	No	Yes	Yes	Owe specific	Yes	Yes	pass		
