ID	Title	URL	Version	Word count	OWE	SPURIOUS	SPECIFIC	LETTER	ROUNDUP	NON-UK EDITION	NON-ENGLISH	VIDEO	NON-DISRUPTIVE OWE	OWE_FOCUSSED	OWE_SPECIFIC_LLM	OWE_SPECIFIC_HUMAN	PASSES_SCREENING	PASSES_SCREENING_SPECIFIC	SUMMARY_CHECK	CORRECTION_INSTRUCTIONS	REPLACED_FIELDS
Daily-Mail_2024-06-29_Wimbledon-hires-more	Wimbledon hires more than a thousand security guards and even removes jigsaws from its shop in a bid to crack down on Just Stop Oil and pro-Palestinian protesters	https://www.dailymail.co.uk/news/article-13583771/Wimbledon-hires-thousand-security-guards-removes-jigsaws-shop-bid-crack-Just-Stop-Oil-pro-Palestinian-protesters.html	original	378	Yes	No	Yes	No	No	No	No	No	No	Yes	No	Owe unspecific	Yes	No	no_check		
The-Guardian_2024-08-21_Labour-promoting-ageold-message	Labour ‘promoting age-old message of fear and hostility’ over migrants, says charity – as it happened	https://www.theguardian.com/politics/live/2024/aug/21/labour-immigration-government-deficit-uk-politics-live?page=with%3Ablock-66c5be0b8f0893d34d6b47d4	original	2543	No	Yes	No	No	Yes	No	No	No	No	No	No	Unused	No	No	no_check		
Daily-Mail_2025-06-27_Lauren-Sanchez-and-Jeff	Lauren Sanchez and Jeff Bezos' A-list guests run for cover as pre-wedding party is hit by huge freak thunderstorm	https://www.dailymail.co.uk/tvshowbiz/article-14852317/Lauren-Sanchez-Jeff-Bezos-guests-run-cover-pre-wedding-party-ruined-huge-thunderstorm.html	original	2095	Yes	No	Yes	No	No	No	No	No	No	No	No	Unused	No	No	no_check		
Daily-Mail_2023-12-11_Just-Stop-Oil	Just Stop Oil activists who took part in slow march across Waterloo Bridge are told by judge they can CONTINUE taking part in 'peaceful' protests before their 2025 trial	https://www.dailymail.co.uk/news/article-12851599/just-stop-oil-march-waterloo-judge-continue-protest-trial.html	original	350	Yes	No	Yes	No	No	No	No	No	No	Yes	Yes	Owe specific	Yes	Yes	no_check		
The-Guardian_2024-07-08_Keir-Starmer-urged	Keir Starmer urged to act on water bill rises in England and Wales	https://www.theguardian.com/business/article/2024/jul/08/keir-starmer-urged-to-act-on-water-bill-rises-in-england-and-wales	original	683	No	No	No	No	No	No	No	No	No	No	No	Unused	No	No	no_check		
Daily-Mail_2024-07-23_Celebrities-including-Coldplays	Celebrities including Coldplay's Chris Martin, film director Danny Boyle and TV's Chris Packham demand meeting with the attorney general over the 'injustice' of JSO eco-zealots M25 plot sentences	https://www.dailymail.co.uk/news/article-13661043/chris-martin-danny-boyle-chris-packham-demand-meeting-just-stop-oil-m25-sentences.html	original	388	Yes	No	Yes	No	No	No	No	No	No	Yes	Yes	Owe specific	Yes	Yes	pass		
Metro_None_My-date-went-in	My date went in for a kiss. Afterwards, I brushed my teeth 18 times	https://metro.co.uk/2024/01/13/brushed-teeth-18-times-worst-first-date-20071572/	original	1541	No	Yes	No	No	No	No	No	No	No	No	No	Unused	No	No	no_check		
Metro_None_Royal-cars-indication-and	Royal cars, indication and the right to assisted suicide	https://metro.co.uk/2024/01/31/royal-cars-indication-right-assisted-suicide-20202991/	original	1520	No	No	Yes	Yes	No	No	No	No	No	No	No	Unused	No	No	no_check		
The-Guardian_2025-09-26_Ladakh-statehood-activist-arrested	Ladakh statehood activist arrested days after violent crackdown by Modi	https://www.theguardian.com/world/2025/sep/26/activist-arrested-ladakh-crackdown-modi-sonam-wangchuk	original	541	No	No	Yes	No	No	No	No	No	No	No	No	Unused	No	No	no_check		
BBC_2025-05-02_How-the-political-consensus	How the political consensus on climate change has shattered	https://www.bbc.com/news/articles/cx20znjejw1o	original	1290	Yes	No	Yes	No	No	No	No	No	No	No	No	Unused	No	No	no_check		
Daily-Mail_2024-03-04_Kerry-Katona-hits	Kerry Katona hits out at being 'judged' for topless OnlyFans shoots while Hollywood stars are lauded for sex scenes as she talks double standards in Straight To The Comments!	https://www.dailymail.co.uk/tvshowbiz/article-13146013/Kerry-Katona-OnlyFans-Hollywood-sex-scenes.html	original	733	No	Yes	No	No	No	No	No	No	No	No	No	Unused	No	No	no_check		
The-Guardian_2025-08-20_Police-investigate-sabotage-claims	Police investigate sabotage claims by UK activists against ‘fossil fuel finance’	https://www.theguardian.com/environment/2025/aug/20/police-investigate-uk-activists-sabotage-fossil-fuel-finance-shut-the-system	original	603	Yes	No	Yes	No	No	No	No	No	No	Yes	Yes	Owe specific	Yes	Yes	pass		
Metro_None_Brian-Cox-tries-to	Brian Cox tries to make sense of Tekken’s story so far in dramatic recap video	https://metro.co.uk/2024/01/10/brian-cox-tries-make-sense-tekkens-story-far-recap-video-20092486/	original	466	No	Yes	Yes	No	No	No	No	No	No	No	No	Unused	No	No	no_check		
Telegraph_2024-09-26_Just-Stop-Oil-soup	Just Stop Oil soup throwers ‘are daring iconoclasts, not criminals’	https://www.telegraph.co.uk/news/2024/09/26/just-stop-oil-soup-throwers-iconoclasts/	original	420	Yes	No	Yes	No	No	No	No	No	No	Yes	Yes	Owe specific	Yes	Yes	form_issue The summarised article contains a formatting error where the subtitle "Art experts call for activists who attacked Van Gogh's Sunflowers to be spared jail" appears twice - once as part of the title section and again as a standalone line before the article body begins. This creates an awkward repetition that would not appear in a properly formatted news article.		
Daily-Mail_2025-01-22_Just-Stop-Oil-doctor	Just Stop Oil doctor loses appeal against being suspended after arguing climate protests did not 'bring the medical profession into disrepute'	https://www.dailymail.co.uk/news/article-14313427/just-stop-oil-doctor-protester-appeal-lost-medical-licence.html	original	931	Yes	No	Yes	No	No	No	No	No	No	Yes	Yes	Owe unspecific	Yes	No	no_check		
Daily-Mail_2024-01-16_Hamass-mouthpiece-news	Hamas's mouthpiece news agency hails Gary Lineker after his anti-Israel post as the BBC star backs down amid claims it was a misunderstanding	https://www.dailymail.co.uk/news/article-12967175/Hamas-news-hails-Gary-Lineker-anti-Israel-post-BBC.html	original	1726	No	Yes	Yes	No	Yes	No	No	No	No	No	No	Unused	No	No	no_check		
The-Guardian_2025-01-09_Greens-attack-Woodside-proposal	Greens attack Woodside proposal to bury CO2 from WA gas project under pristine reef	https://www.theguardian.com/australia-news/2025/jan/10/woodside-ccs-proposal-bury-co2-under-scott-reef	original	702	No	No	No	No	No	No	No	No	No	No	No	Unused	No	No	no_check		
Metro_None_What-impact-will-the	What impact will the oil tanker explosion have on the environment?	https://metro.co.uk/2025/03/10/impact-will-oil-tanker-explosion-environment-22700631/	original	1202	No	No	No	No	No	No	No	No	No	No	No	Unused	No	No	no_check		
Telegraph_2024-09-25_Miliband-sends-armed-police	Miliband sends armed police to guard gas terminals amid net zero protests	https://www.telegraph.co.uk/business/2024/09/25/ed-miliband-armed-police-guard-gas-terminals-net-zero/	original	707	Yes	No	Yes	No	No	No	No	No	No	Yes	No	Owe unspecific	Yes	No	no_check		
Daily-Mail_2025-02-26_BP-abandons-green-energy	BP abandons green energy drive by slashing renewables budget and ploughing extra £8bn into oil and gas	https://www.dailymail.co.uk/news/article-14438325/BP-plans-slash-spending-green-energy.html	original	911	No	No	No	No	No	No	No	No	No	No	No	Unused	No	No	no_check		
The-Guardian_2024-06-28_Dozens-of-Just	Dozens of Just Stop Oil activists arrested on suspicion of planning to disrupt airports	https://www.theguardian.com/uk-news/article/2024/jun/28/just-stop-oil-activists-arrested-suspicion-planning-disrupt-airports	original	384	Yes	No	No	No	No	No	No	No	No	Yes	No	Owe unspecific	Yes	No	no_check		
Metro_None_Gazza-says-hes-emotionally	Gazza says he’s ’emotionally soft’ as he compares himself to Taylor Swift	https://metro.co.uk/2024/06/20/gazza-says-emotionally-soft-compares-taylor-swift-21074405/	original	879	No	Yes	No	No	No	No	No	No	No	No	No	Unused	No	No	no_check		
Metro_None_Met-to-use-all	Met to use ‘all of their powers’ to stop Remembrance Day protesters	https://metro.co.uk/2023/11/03/met-to-use-all-of-their-powers-to-stop-remembrance-day-protesters-19766983/	original	583	No	No	Yes	No	No	No	No	No	No	No	No	Unused	No	No	no_check		
The-Guardian_2024-04-08_Russia-and-Ukraine-trade	Russia and Ukraine trade blame over Zaporizhzhia nuclear plant drone strike	https://www.theguardian.com/world/2024/apr/08/russia-ukraine-zaporizhzhia-nuclear-power-plant-drone-strike	original	478	No	Yes	No	No	No	No	No	No	No	No	No	Unused	No	No	no_check		
Metro_None_I-was-13-when	I was 13 when I was groomed by an actor in plain sight. No one did anything to stop it	https://metro.co.uk/2023/12/24/13-groomed-actor-plain-sight-20003029/	original	1307	No	Yes	No	No	No	No	No	No	No	No	No	Unused	No	No	no_check		
Daily-Mail_2024-07-06_Met-police-arrest	Met police arrest four as thousands of pro-Palestinian supporters march through London on first Gaza demo under Labour	https://www.dailymail.co.uk/news/article-13606945/Thousands-pro-Palestinian-supporters-march-London-near-counter-protesters-Met-says-700-police-hand-stop-crime-disorder.html	original	705	No	No	No	No	No	No	No	No	No	No	No	Unused	No	No	no_check		
Daily-Mail_2024-02-13_Climate-activists-target	Climate activists target Botticelli's famed Birth of Venus: Protesters stick pictures of flooded towns on glass protector at Uffizi museum in Florence before being marched to a police station	https://www.dailymail.co.uk/news/article-13079389/Climate-activists-target-Botticellis-Birth-Venus-protest-Florence.html	original	989	Yes	No	Yes	No	No	No	No	No	No	Yes	Yes	Owe specific	Yes	Yes	pass		
BBC_2025-06-24_Venice-protesters-claim-victory	Venice protesters claim victory as Jeff Bezos changes wedding venue	https://www.bbc.com/news/articles/cd0vjr07570o	original	722	No	No	Yes	No	No	No	No	No	No	No	No	Unused	No	No	no_check		
The-Guardian_2025-03-05_Ban-on-new-drilling	Ban on new drilling confirmed as ministers consult on North Sea’s ‘clean energy future’	https://www.theguardian.com/business/2025/mar/05/ban-on-new-drilling-confirmed-as-ministers-consult-on-north-sea-clean-energy-future	original	778	No	No	No	No	No	No	No	No	No	No	No	Unused	No	No	no_check		
The-Guardian_2024-03-03_UK-ministers-consider	UK ministers consider ban on MPs engaging with pro-Palestine and climate protesters	https://www.theguardian.com/world/2024/mar/03/ministers-consider-ban-mps-engaging-pro-palestine-climate-protesters	original	877	Yes	No	Yes	No	No	No	No	No	No	Yes	No	Owe unspecific	Yes	No	no_check		
BBC_2023-12-23_Prevent-Rise-in-climate	Prevent: Rise in climate activists referred to anti-terror scheme	https://www.bbc.com/news/uk-67665218	original	1271	Yes	No	Yes	No	No	No	No	No	No	Yes	No	Owe unspecific	Yes	No	no_check		
Sky_2024-02-08_Labour-confirms-Uturn	Labour confirms U-turn on £28bn green spending pledge	https://news.sky.com/story/labour-confirms-u-turn-on-28bn-green-spending-pledge-13066856	original	1093	No	No	No	No	No	No	No	No	No	No	No	Unused	No	No	no_check		
The-Guardian_2025-02-20_Fossil-fuel-firms-300m	Fossil fuel firm’s $300m trial against Greenpeace to begin: ‘Weaponizing the judicial system’	https://www.theguardian.com/us-news/2025/feb/20/greenpeace-energy-transfer-dakota-pipeline-trial	original	1944	Yes	No	Yes	No	No	No	No	No	No	Yes	No	Not even owe	Yes	No	no_check		
The-Guardian_2023-10-31_BP-plays-down	BP plays down takeover speculation after lower than expected profits	https://www.theguardian.com/business/2023/oct/31/bp-profits-gas-bernard-looney	original	786	No	No	No	No	No	No	No	No	No	No	No	Unused	No	No	no_check		
BBC_2023-10-21_Recycling-reforms-see-separate	Recycling reforms see separate food waste bins for England	https://www.bbc.com/news/science-environment-67176392	original	434	No	No	No	No	No	No	No	No	No	No	No	Unused	No	No	no_check		
The-Times_2024-07-19_Police-fear-Just-Stop	Police fear Just Stop Oil jail sentences will spark more protests	https://www.thetimes.com/uk/crime/article/police-fear-just-stop-oil-jail-sentences-will-spark-more-protests-fzrbs6cp0	original	781	Yes	No	Yes	No	No	No	No	No	No	Yes	Yes	Owe specific	Yes	Yes	pass		
Telegraph_2024-05-14_Just-Stop-Oil-protester	Just Stop Oil protester who painted Scotland Yard sign orange cleared after comparison to Rosa Parks	https://www.telegraph.co.uk/news/2024/05/14/climate-protester-cleared-scotland-yard-paint-rosa-parks/	original	351	Yes	No	Yes	No	No	No	No	No	No	Yes	Yes	Owe specific	Yes	Yes	pass		
Metro_None_I-was-asked-out	I was asked out on a date while on a date with someone else – I said yes	https://metro.co.uk/2023/12/29/asked-a-date-a-date-someone-else-said-yes-20014736/	original	1391	No	Yes	No	No	No	No	No	No	No	No	No	Unused	No	No	no_check		
The-Guardian_2023-12-07_Hedge-fund-billionaire	Hedge fund billionaire Sir Chris Hohn paid himself £276m in 2023	https://www.theguardian.com/business/2023/dec/07/hedge-fund-billionaire-sir-chris-hohn-paid-himself-276m-this-year	original	586	No	No	Yes	No	No	No	No	No	No	No	No	Unused	No	No	no_check		
ITV_2024-11-24_Poorer-nations-express-frustration	Poorer nations express frustration after last minute COP29 deal	https://www.itv.com/news/2024-11-23/cop29-nations-agree-to-300-billion-climate-finance-deal-for-poorer-countries	original	920	No	No	No	No	No	No	No	No	No	No	No	Unused	No	No	no_check		
The-Guardian_None_Nearly-175-arrested	Nearly 175 arrested as climate protesters target France’s TotalEnergies and key investor	https://www.theguardian.com/environment/article/2024/may/25/nearly-175-arrested-as-climate-protesters-target-frances-totalenergies-and-key-investor	original	382	Yes	No	Yes	No	No	No	No	No	No	Yes	Yes	Owe specific	Yes	Yes	pass		
Sky_2025-07-30_Palestine-Actions-bid-for	Palestine Action's bid for judicial review granted after MPs banned group	https://news.sky.com/story/palestine-actions-bid-for-judicial-review-granted-after-mps-banned-group-13403514	original	738	No	No	Yes	No	No	No	No	No	No	No	No	Unused	No	No	no_check		
The-Guardian_2023-12-14_Qantas-calls-cash	Qantas calls cash compensation for delayed flights a ‘backwards step’ – as it happened	https://www.theguardian.com/australia-news/live/2023/dec/14/australia-news-live-cyclone-jasper-north-queensland-flooding-storm-climate-change-global-warming-fossil-fuels-cop?page=with:block-657a24018f0805d21b575c6f	original	1719	No	No	Yes	No	Yes	No	No	No	No	No	No	Unused	No	No	no_check		
The-Guardian_2024-03-07_Carved-up-and	Carved up and sold off: developers plan a ‘new Miami’ in Argentina’s nature-rich wetlands	https://www.theguardian.com/global-development/2024/mar/07/carved-up-and-sold-off-parana-delta-developers-plan-a-new-miami-in-argentina-nature-rich-wetlands	original	1385	No	No	No	No	No	No	No	No	No	No	No	Unused	No	No	no_check		
The-Guardian_2024-04-06_Greta-Thunberg-detained	Greta Thunberg detained at The Hague climate demonstration	https://www.theguardian.com/environment/2024/apr/06/greta-thunberg-detained-at-hague-climate-demonstration	original	383	Yes	No	Yes	No	No	No	No	No	No	Yes	Yes	Owe specific	Yes	Yes	pass		
The-Guardian_2024-07-28_The-end-is	The end is nigh. For insects, bats, protest, the planet…	https://www.theguardian.com/commentisfree/article/2024/jul/28/the-end-is-nigh-for-insects-bats-protest-the-planet	original	1047	Yes	No	Yes	No	No	No	No	No	No	Yes	No	Not even owe	Yes	No	no_check		
BBC_2024-07-22_Just-Stop-Oil-activists	Just Stop Oil activists bailed	https://www.bbc.com/news/articles/cz47g49gz1do	original	247	Yes	No	Yes	No	No	No	No	No	No	Yes	Yes	Owe specific	Yes	Yes	no_check		
Mirror_2024-09-20_Kirsty-Gallacher-backs-Mirror	Kirsty Gallacher backs Mirror campaign for ban on 'cruel and ugly' fur sales in UK	https://www.mirror.co.uk/news/uk-news/kirsty-gallacher-backs-mirror-campaign-33716586	original	963	No	No	Yes	No	No	No	No	No	No	No	No	Unused	No	No	no_check		
The-Guardian_2025-08-07_More-than-200-lobbyists	More than 200 lobbyists at UN’s plastic treaty talks will limit progress, campaigners warn	https://www.theguardian.com/environment/2025/aug/07/more-than-200-lobbyists-at-uns-plastic-treaty-talks-will-limit-progress-campaigners-warn	original	891	No	No	No	No	No	No	No	No	No	No	No	Unused	No	No	no_check		
The-Guardian_None_More-than-150-lawyers	More than 150 lawyers and refugee NGOs report being ‘pressured into silence’ by far-right protesters	https://www.theguardian.com/uk-news/2025/sep/22/more-than-150-lawyers-and-refugee-ngos-report-being-pressured-into-silence-by-far-right-protesters	original	520	No	Yes	No	No	No	No	No	No	No	No	No	Unused	No	No	no_check		
The-Guardian_2024-11-24_Cop29-climate-finance-deal	Cop29 climate finance deal criticised as ‘travesty of justice’ and ‘stage-managed’	https://www.theguardian.com/environment/2024/nov/24/cop29-climate-finance-deal-criticised-travesty-justice-stage-managed	original	1030	No	No	No	No	No	No	No	No	No	No	No	Unused	No	No	no_check		
Metro_None_This-TV-show-meant	This TV show meant the world to me as a queer person… and now it’s gone	https://metro.co.uk/2024/01/11/flag-means-death-much-a-gay-pirate-show-20100918/	original	1270	No	Yes	No	No	No	No	No	No	No	No	No	Unused	No	No	no_check		
Metro_None_A-holiday-in-Blackpool	A holiday in Blackpool helped me come out as trans	https://metro.co.uk/2024/01/21/terrified-go-holiday-found-perfect-solution-20134454/	original	1882	No	Yes	No	No	No	No	No	No	No	No	No	Unused	No	No	no_check		
Metro_None_I-opened-the-door	I opened the door for a delivery – then I realised I was half naked	https://metro.co.uk/2024/01/08/a-stern-word-boss-made-realise-laugh-cancer-20064001/	original	1858	No	Yes	No	No	No	No	No	No	No	No	No	Unused	No	No	no_check		
Metro_None_Leave-Amanda-Holden-alone	Leave Amanda Holden alone – she had every right to party at her daughter’s 18th	https://metro.co.uk/2024/01/22/leave-amanda-holden-alone-age-children-shouldnt-mean-no-fun-20152679/	original	965	No	Yes	No	No	No	No	No	No	No	No	No	Unused	No	No	no_check		
Sky_2023-12-05_Unprecedented-2400-fuel	'Unprecedented' 2,400 fuel lobbyists at COP28 in Dubai, claim campaigners	https://news.sky.com/story/unprecedented-2-400-fuel-lobbyists-at-cop28-in-dubai-claim-campaigners-13023153	original	473	No	No	No	No	No	No	No	No	No	No	No	Unused	No	No	no_check		
The-Guardian_2024-01-16_Will-we-leave	‘Will we leave things to the fascists?’: the activist aiming to revive Germany’s far-left party	https://www.theguardian.com/world/2024/jan/16/carola-rackete-activist-aiming-to-revive-germany-far-left-die-linke-party	original	1070	No	No	Yes	No	No	No	No	No	No	No	No	Unused	No	No	no_check		
Metro_None_I-didnt-realise-Id	I didn’t realise I’d been groomed and trafficked – then the panic attacks started	https://metro.co.uk/2024/01/01/forced-sex-1-500-men-5-years-20037771/	original	1859	No	Yes	No	No	No	No	No	No	No	No	No	Unused	No	No	no_check		
BBC_2024-09-04_Antiwhaling-activist-Paul-Watson	Anti-whaling activist Paul Watson kept in Greenland jail	https://www.bbc.com/news/articles/cewlqp7q0rwo	original	754	Yes	No	Yes	No	No	No	No	No	No	Yes	No	Owe specific	Yes	Yes	pass		
BBC_2024-11-16_Billions-at-stake-in	Billions at stake in court battle over North Sea oil	https://www.bbc.com/news/articles/ce89er3ekn0o	original	1255	No	No	Yes	No	No	No	No	No	No	No	No	Unused	No	No	no_check		
Mirror_2024-03-23_Environmental-activists-Just-Stop	Environmental activists Just Stop Oil calling on UN to defend their 'human right to protest'	https://www.mirror.co.uk/news/uk-news/environmental-activists-just-stop-oil-32426378	original	367	Yes	No	Yes	No	No	No	No	No	No	Yes	No	Owe unspecific	Yes	No	no_check		
The-Guardian_2025-06-10_How-does-woke-start	How does woke start winning again?	https://www.theguardian.com/news/2025/jun/10/how-does-woke-start-winning-again	original	4712	Yes	No	Yes	No	No	No	No	No	No	No	No	Unused	No	No	no_check		
The-Guardian_2023-11-06_Just-Stop-Oil	Just Stop Oil protesters smash glass on painting at National Gallery	https://www.theguardian.com/uk-news/2023/nov/06/just-stop-oil-protesters-smash-glass-painting-national-gallery	original	354	Yes	No	Yes	No	No	No	No	No	No	Yes	Yes	Owe unspecific	Yes	No	no_check		
BBC_2024-07-09_Urgent-action-needed-to	Urgent action needed to keep services - council	https://www.bbc.com/news/articles/cprqevz717go	original	316	Yes	No	Yes	No	No	No	No	No	No	No	No	Unused	No	No	no_check		
BBC_2024-06-19_Just-Stop-Oil-What	Just Stop Oil: What is it and what are its goals?	https://www.bbc.com/news/uk-63543307	original	844	Yes	No	Yes	No	No	No	No	No	No	Yes	No	Owe unspecific	Yes	No	no_check		
The-Guardian_2025-03-24_Labors-bid-to-protect	Labor’s bid to protect Tasmanian salmon industry met with unease from pro-environment MPs	https://www.theguardian.com/australia-news/2025/mar/24/labor-tasmanian-salmon-industry-protection-promises-anthony-albanese	original	780	No	No	No	No	No	No	No	No	No	No	No	Unused	No	No	no_check		
Metro_None_I-did-a-naked	I did a naked photoshoot at 46 and it cured my low self-esteem	https://metro.co.uk/2023/11/13/a-naked-photoshoot-46-cured-low-self-esteem-19814002/	original	1570	No	Yes	No	No	No	No	No	No	No	No	No	Unused	No	No	no_check		
The-Guardian_2023-12-02_Deep-sea-miners	Deep sea miners turn water hoses on Greenpeace activists in the Pacific	https://www.theguardian.com/environment/2023/dec/02/deep-sea-miners-turn-water-hoses-on-greenpeace-activists-in-the-pacific	original	508	Yes	No	Yes	No	No	No	No	No	No	Yes	Yes	Owe specific	Yes	Yes	pass		
BBC_2024-04-26_MP-hits-out-at	MP hits out at 'spoilt middle-class climate clowns'	https://www.bbc.com/news/articles/c0de49lyxvmo	original	473	Yes	No	Yes	No	No	No	No	No	No	Yes	Yes	Owe specific	Yes	Yes	pass		
BBC_2024-12-02_Norway-suspends-controversial-deepsea	Norway suspends controversial deep-sea mining plan	https://www.bbc.com/news/articles/c9wlj8l8kr7o	original	399	No	No	No	No	No	No	No	No	No	No	No	Unused	No	No	no_check		
The-Guardian_2023-12-15_Just-Stop-Oil	Just Stop Oil activist jailed for six months for taking part in slow march	https://www.theguardian.com/environment/2023/dec/15/just-stop-oil-activist-is-first-to-be-jailed-under-new-uk-protest-law	original	519	Yes	No	Yes	No	No	No	No	No	No	Yes	Yes	Owe specific	Yes	Yes	pass		
Metro_None_A-sinister-Mumsnet-post	A sinister Mumsnet post has left me terrified for my daughter	https://metro.co.uk/2023/12/18/a-sinister-mumsnet-post-left-terrified-daughter-19991899/	original	1135	No	Yes	Yes	No	No	No	No	No	No	No	No	Unused	No	No	no_check		
The-Guardian_2025-01-10_Pound-and-UK-bonds	Pound and UK bonds fall after strong US jobs report; UK gas storage levels are ‘concerningly low’ – as it happened	https://www.theguardian.com/business/live/2025/jan/10/sainsbury-hike-wages-christmas-pound-dips-bond-sell-off-us-jobs-payrolls-december-business-live-news	original	2294	No	Yes	No	No	Yes	No	No	No	No	No	No	Unused	No	No	no_check		
Metro_None_Im-constantly-told-I	I’m constantly told I don’t look ‘gay enough’	https://metro.co.uk/2023/11/30/im-constantly-told-dont-look-gay-enough-19885798/	original	1380	No	Yes	No	No	No	No	No	No	No	No	No	Unused	No	No	no_check		
The-Guardian_2023-11-07_Tuesday-briefing-Why	Tuesday briefing: Why eco-conscious King Charles is announcing new gas and oil projects today	https://www.theguardian.com/world/2023/nov/07/first-edition-king-charles-kings-speech-oil-and-gas	original	2512	Yes	No	Yes	No	No	No	No	No	No	No	No	Unused	No	No	no_check		
Metro_None_A-friends-clumsy-question	A friend’s clumsy question about my mental health taught me an important lesson	https://metro.co.uk/2023/11/11/a-friends-rude-question-about-my-mental-health-taught-me-a-lesson-19697656/	original	1403	No	Yes	No	No	No	No	No	No	No	No	No	Unused	No	No	no_check		
Sky_2023-11-10_Rishi-Sunak-urged	Rishi Sunak urged to sack Suella Braverman over 'deeply offensive' article on pro-Palestinian marches	https://news.sky.com/story/rishi-sunak-urged-to-sack-suella-braverman-over-deeply-offensive-article-on-pro-palestinian-marches-13003749	original	1357	No	No	No	No	No	No	No	No	No	No	No	Unused	No	No	no_check		
Sky_2024-02-02_Greta-Thunberg-cleared-of	Greta Thunberg cleared of public order offence after judge throws out charge	https://news.sky.com/story/greta-thunberg-cleared-of-public-order-offence-after-judge-throws-out-charge-13062300	original	420	Yes	No	Yes	No	No	No	No	No	No	No	Yes	Unused	No	No	no_check		
Sky_2023-10-25_Three-arrests-after	Three arrests after Just Stop Oil protesters spray orange paint on London's Wellington Arch	https://news.sky.com/story/three-arrests-after-just-stop-oil-protesters-spray-orange-paint-on-londons-wellington-arch-12992416	original	400	Yes	No	Yes	No	No	No	No	No	No	Yes	Yes	Owe specific	Yes	Yes	form_issue The summarised article contains a duplication error where the subtitle "The latest protest comes just weeks after the government backed the development of the UK's largest untapped oil and gas field - and follows similar action by other campaigners." appears twice - once at the beginning as intended, and again at the very end of the article. This repetition creates a structural problem that makes the summary implausible as a properly formatted news article.		
Sky_2023-12-24_2023s-best-funniest	2023's best, funniest and most WTF moments	https://news.sky.com/story/2023s-best-funniest-and-most-wtf-moments-13030106	original	2559	Yes	No	Yes	No	Yes	No	No	No	No	No	No	Unused	No	No	no_check		
Sky_2024-01-23_Oil-and-gas	Oil and gas vote is a political boost for PM - but won't help our energy needs	https://news.sky.com/story/oil-and-gas-vote-is-a-political-boost-for-pm-but-wont-help-our-energy-needs-13054331	original	848	Yes	No	Yes	No	No	No	No	No	No	No	No	Unused	No	No	no_check		
ITV_2024-07-10_Just-Stop-Oil	Just Stop Oil activists avoid prison over World Snooker Championship protest	https://www.itv.com/news/calendar/2024-07-10/just-stop-oil-activists-avoid-prison-over-world-snooker-protest	original	677	Yes	No	Yes	No	No	No	No	No	No	Yes	Yes	Owe specific	Yes	Yes	pass		
