ID	Title	URL	Version	Word count	OWE	SPURIOUS	SPECIFIC	LETTER	ROUNDUP	NON-UK EDITION	NON-ENGLISH	VIDEO	NON-DISRUPTIVE OWE	OWE_FOCUSSED	OWE_SPECIFIC_LLM	OWE_SPECIFIC_HUMAN	PASSES_SCREENING	PASSES_SCREENING_SPECIFIC	SUMMARY_CHECK	CORRECTION_INSTRUCTIONS	REPLACED_FIELDS
BBC_2025-09-22_Arrests-after-gas-protesters	Arrests after gas protesters scale chimney stacks	https://www.bbc.com/news/articles/crkjlerz7l6o	original	264	Yes	No	Yes	No	No	No	No	No	No	Yes	Yes	Owe specific	Yes	Yes	no_check		
The-Times_2024-06-02_Attacking-art-should-be	Attacking art ‘should be criminal offence even if there’s no damage’	https://www.thetimes.com/world/europe/article/attacking-art-should-be-criminal-offence-even-if-theres-no-damage-lhf2vhjrq	original	404	Yes	No	Yes	No	No	No	No	No	No	Yes	Yes	Owe specific	Yes	Yes	pass		
The-Guardian_2025-01-10_No-10-insists-UK	No 10 insists UK has sufficient energy supply despite ‘concerningly low’ gas storage levels	https://www.theguardian.com/business/2025/jan/10/uk-energy-supply-gas-storage-levels-centrica	original	682	No	Yes	No	No	No	No	No	No	No	No	No	Unused	No	No	no_check		
The-Guardian_2024-07-16_Buses-trains-and-bicycle	Buses, trains and bicycle paths: Labour’s mission to decarbonise UK transport	https://www.theguardian.com/environment/article/2024/jul/16/buses-trains-bicycle-paths-labour-mission-decarbonise-transport	original	920	No	No	No	No	No	No	No	No	No	No	No	Unused	No	No	no_check		
Metro_None_I-was-only-four	I was only four when I first felt like a burden	https://metro.co.uk/2023/11/26/disabled-people-sick-made-feel-shame-needs-19870122/	original	1302	No	Yes	No	No	No	No	No	No	No	No	No	Unused	No	No	no_check		
The-Guardian_2024-07-11_Just-Stop-Oil	Just Stop Oil activists found guilty of conspiring to block M25 traffic	https://www.theguardian.com/uk-news/article/2024/jul/11/just-stop-oil-activists-found-guilty-of-conspiring-to-block-m25-traffic	original	690	Yes	No	Yes	No	No	No	No	No	No	Yes	Yes	Owe specific	Yes	Yes	pass		
Sky_2023-12-18_Pakistan-uses-artificial	Pakistan uses artificial rain to battle smog for first time	https://news.sky.com/story/pakistan-uses-artificial-rain-to-battle-smog-for-first-time-13033304	original	325	No	Yes	No	No	No	No	No	No	No	No	No	Unused	No	No	no_check		
The-Guardian_2024-05-17_UK-government-adviser	UK government adviser on disruptive protest accused of conflict of interest	https://www.theguardian.com/world/article/2024/may/17/government-adviser-on-disruptive-protest-accused-of-conflict-of-interest	original	890	Yes	No	Yes	No	No	No	No	No	No	Yes	No	Owe unspecific	Yes	No	no_check		
Sun_2023-10-17_PROTEST-ARREST-Ecowarrior-Greta	PROTEST ARREST Eco-warrior Greta Thunberg arrested after joining protest outside conference in London	https://www.thesun.co.uk/news/24433600/greta-thunberg-arrestedprotest-conference-london/	original	179	Yes	No	Yes	No	No	No	No	No	No	Yes	Yes	Owe specific	Yes	Yes	no_check		
BBC_2024-03-26_Offshore-Energies-UK-report	Offshore Energies UK report: Oil and gas fight for survival	https://www.bbc.com/news/uk-scotland-scotland-business-68668648	original	1249	Yes	No	Yes	No	No	No	No	No	No	No	No	Unused	No	No	no_check		
The-Guardian_2025-08-15_Palestine-Action-prosecutions-should	Palestine Action prosecutions should be suspended, say UK rights groups	https://www.theguardian.com/world/2025/aug/15/palestine-action-prosecutions-should-be-suspended-uk-rights-groups	original	752	Yes	No	Yes	No	No	No	No	No	No	No	No	Unused	No	No	no_check		
The-Guardian_2024-05-08_First-trial-of	First trial of Just Stop Oil activists under new anti-protest laws begins	https://www.theguardian.com/uk-news/article/2024/may/08/first-trial-of-just-stop-oil-activists-phoebe-plummer-chiara-sarti-daniel-hall-anti-protest-laws-begins	original	301	Yes	No	Yes	No	No	No	No	No	No	Yes	Yes	Owe specific	Yes	Yes	no_check		
BBC_2024-04-18_Scrapped-climate-target-is	Scrapped climate target is global embarrassment - charities	https://www.bbc.com/news/articles/cpwgejq14pwo	original	693	No	No	No	No	No	No	No	No	No	No	No	Unused	No	No	no_check		
The-Guardian_None_Activists-warn-of	Activists warn of ‘extreme anger’ if ministers fail to reform water regulator	https://www.theguardian.com/environment/article/2024/aug/14/activists-warn-of-extreme-anger-if-ministers-fail-to-reform-water-regulator	original	927	No	No	No	No	No	No	No	No	Yes	No	No	Unused	No	No	no_check		
The-Guardian_2024-11-14_Cop29-solidarity-levy-on	Cop29: solidarity levy on cryptocurrency could raise billions for climate action, says report – as it happened	https://www.theguardian.com/environment/live/2024/nov/14/cop29-live-can-the-climate-summit-find-a-way-to-raise-1tn-a-year	original	4155	No	No	Yes	No	Yes	No	No	No	No	No	No	Unused	No	No	no_check		
The-Guardian_2024-02-21_Forget-Labour-and	Forget Labour and the Tories: the ‘carbon parties’ will not save us. That’s why Just Stop Oil wants your votes	https://www.theguardian.com/commentisfree/2024/feb/21/labour-tories-carbon-parties-just-stop-oil-mps-parliament	original	820	Yes	No	No	No	No	No	No	No	No	Yes	No	Owe unspecific	Yes	No	no_check		
The-Guardian_2024-05-15_UK-climate-activists	UK climate activists convicted in first trial of new anti-protest laws	https://www.theguardian.com/uk-news/article/2024/may/15/uk-climate-activists-convicted-in-first-trial-of-new-anti-protest-laws	original	625	Yes	No	Yes	No	No	No	No	No	No	Yes	Yes	Owe specific	Yes	Yes	pass		
Sun_2024-07-19_JUST-APPALLING-I-went	JUST APPALLING I went undercover to smash Just Stop Oil’s plot to halt M25 and was shocked by sinister boasts of sneering ringleaders	https://www.thesun.co.uk/news/29351268/undercover-just-stop-oil-plot-m25/	original	1417	Yes	No	Yes	No	No	No	No	No	No	Yes	Yes	Owe specific	Yes	Yes	consistency_issue The summary significantly alters the tone and balance of the original article. The original maintains a strong negative portrayal of the protesters throughout, describing them as "eco zealots," a "cult," and "fanatics," with extensive coverage of the journalist's undercover operation, court proceedings, and vindication of The Sun's reporting. The summary removes most of this critical framing, including the cult-like characterization, the detailed account of the journalist's testimony and cross-examination, the judge's condemnation of the protesters as "fanatics," and The Sun's celebration of their role in stopping the protest. The summary presents a more neutral account that focuses mainly on the basic facts of the plot and sentencing, losing the original's strongly negative editorial stance against the protesters.	The summary alters the tone and balance of the original article. The original maintains a strong negative portrayal of the protesters throughout, describing them as "eco zealots," a "cult," and "fanatics," with extensive coverage of the journalist's undercover operation, court proceedings, and vindication of The Sun's reporting. The summary removes most of this critical framing, including the cult-like characterization, the judge's condemnation of the protesters as "fanatics," and The Sun's celebration of their role in stopping the protest. The key aspects of the protest itself must be covered, but not at the expense of losing the original's strongly negative editorial stance against the protesters.	
Metro_None_My-ex-insisted-on	My ex insisted on knowing my body count – he instantly regretted it	https://metro.co.uk/2023/12/01/https-metro-co-uk-2024-01-02-ex-insisted-knowing-body-count-instantly-regretted-2-20053028-19911341/	original	1274	No	Yes	No	No	No	No	No	No	No	No	No	Unused	No	No	no_check		
Metro_None_Love-Actually-has-aged	Love Actually has aged badly – but it was never any good to begin with	https://metro.co.uk/2023/11/14/love-actually-aged-badly-never-good-begin-19812188/	original	1178	No	Yes	Yes	No	No	No	No	No	No	No	No	Unused	No	No	no_check		
The-Guardian_2024-09-21_Retired-priest-speaks	Retired priest speaks of ‘painful’ treatment by church over her climate protests	https://www.theguardian.com/environment/2024/sep/21/retired-priest-painful-treatment-church-climate-protests	original	698	Yes	No	Yes	No	No	No	No	No	No	Yes	No	Owe specific	Yes	Yes	pass		
The-Guardian_2024-09-23_Pessimism-is-a	‘Pessimism is a luxury we can’t afford’: Kumi Naidoo on fighting fossil fuels with art and culture	https://www.theguardian.com/us-news/2024/sep/23/kumi-naidoo-fossil-fuels-activism-art-culture	original	1871	No	No	Yes	No	No	No	No	No	No	No	No	Unused	No	No	no_check		
Sky_2024-07-25_Just-Stop-Oil	Just Stop Oil activists found guilty after throwing soup over Van Gogh's Sunflowers	https://news.sky.com/story/just-stop-oil-activists-found-guilty-of-criminal-damage-after-throwing-soup-over-van-goghs-sunflowers-13184835	original	333	Yes	No	Yes	No	No	No	No	No	No	Yes	Yes	Owe specific	Yes	Yes	no_check		
Metro_None_I-will-spend-every	I will spend every day of the rest of my life worried about my cancer coming back	https://metro.co.uk/2023/10/29/there-is-no-such-thing-as-the-all-clear-after-breast-cancer-19694221/	original	1423	No	Yes	No	No	No	No	No	No	No	No	No	Unused	No	No	no_check		
The-Guardian_2024-01-27_Greta-Thunberg-joins	Greta Thunberg joins protest against expansion of Hampshire airport	https://www.theguardian.com/environment/2024/jan/27/greta-thunberg-joins-protest-against-expansion-of-hampshire-airport	original	456	No	No	Yes	No	No	No	No	No	Yes	No	Yes	Unused	No	No	no_check		
The-Guardian_2024-11-07_It-can-lead-to	‘It can lead to chaos’: false claims and hoaxes surge as Spain’s floods recede	https://www.theguardian.com/world/2024/nov/07/it-can-lead-to-chaos-false-claims-and-hoaxes-surge-as-spains-floods-recede	original	897	No	Yes	No	No	No	No	No	No	No	No	No	Unused	No	No	no_check		
The-Guardian_None_I-had-to	‘I had to find a way to survive’: ultrarunner Sabrina Pace-Humphreys on racing, racism and learning to love the outdoors	https://www.theguardian.com/lifeandstyle/2023/dec/24/i-had-to-find-a-way-to-survive-sabrina-pace-humphreys-on-race-and-trail-running	original	1695	No	Yes	No	No	No	No	No	No	No	No	No	Unused	No	No	no_check		
The-Guardian_2024-10-22_New-commission-may-ban	New commission may ban English water companies from making a profit	https://www.theguardian.com/environment/2024/oct/22/new-commission-may-ban-england-water-companies-from-making-a-profit	original	1003	No	No	No	No	No	No	No	No	No	No	No	Unused	No	No	no_check		
The-Guardian_2024-08-25_Police-acting-as	Police acting as ‘private security’ for Drax power station, say climate activists	https://www.theguardian.com/business/article/2024/aug/25/police-acting-as-private-security-for-drax-power-station-say-climate-activists	original	941	Yes	No	Yes	No	No	No	No	No	No	Yes	Yes	Not even owe	Yes	No	no_check		
The-Guardian_None_Record-number-of-electric	Record number of electric cars were sold in UK during 2024	https://www.theguardian.com/business/2025/jan/04/record-number-of-electric-cars-were-sold-in-uk-during-2024	original	695	No	No	No	No	No	No	No	No	No	No	No	Unused	No	No	no_check		
The-Guardian_2025-02-11_BP-chief-says-it	BP chief says it will ‘fundamentally reset’ amid threat of activist investor	https://www.theguardian.com/business/2025/feb/11/bp-chief-profits-murray-auchincloss-elliott	original	849	No	No	No	No	No	No	No	No	No	No	No	Unused	No	No	no_check		
Sun_2024-06-08_ECO-WAR-We-were	ECO WAR We were shot at like in a James Bond movie, says Greenpeace activist in new BBC documentary about oil rig mission	https://www.thesun.co.uk/tv/28380624/bbc-two-documentary-on-thin-ice-putin-greenpeace/	original	1403	Yes	No	Yes	No	No	No	No	No	No	Yes	Yes	Owe specific	Yes	Yes	consistency_issue, form_issue The summary has a consistency issue because it omits crucial elements that were central to the original story's narrative and impact. The original article emphasized key dramatic elements like the memory card smuggled out in a matchbox, Paul McCartney's letter to Putin, and the international campaign that helped free the activists. The summary reduces this to simply stating the charges were reduced and they were freed, without explaining how or why this happened. This significantly changes the balance and tone from a dramatic story of international intrigue and celebrity intervention to a much more mundane account. The summary has a form issue because it contains a duplicated opening line - "THE new documentary investigates the British Greenpeace activists who planned to protest from the side of an oil rig in the Arctic" appears twice consecutively, which is a formatting error that would not appear in a proper news article.		
Sky_2024-06-29_Third-person-arrested	Third person arrested after Stonehenge sprayed with orange paint powder	https://news.sky.com/story/third-person-arrested-after-stonehenge-sprayed-with-orange-paint-powder-13160830	original	309	Yes	No	Yes	No	No	No	No	No	No	Yes	Yes	Owe specific	Yes	Yes	no_check		
The-Guardian_2024-11-26_How-the-battle-of	How the battle of Claremont Road changed the world: ‘The whole of alternative London turned up’	https://www.theguardian.com/environment/2024/nov/26/how-the-battle-of-claremont-road-changed-the-world-the-whole-of-alternative-london-turned-up	original	2355	Yes	No	Yes	No	No	No	No	No	No	Yes	Yes	Owe specific	Yes	Yes	pass		
The-Guardian_2025-06-26_EU-rollback-on-environmental	EU rollback on environmental policy is gaining momentum, warn campaigners	https://www.theguardian.com/environment/2025/jun/26/eu-rollback-on-environmental-policy-deregulation-european-green-deal	original	1172	No	No	No	No	No	No	No	No	Yes	No	No	Unused	No	No	no_check		
BBC_2024-04-22_Who-is-the-Britain	Who is the Britain First candidate Nick Scanlon?	https://www.bbc.com/news/articles/cx8qxvr3y1ro	original	244	Yes	No	Yes	No	No	No	No	No	No	No	No	Unused	No	No	no_check		
BBC_2024-04-18_GP-could-be-struck	GP could be struck off after Just Stop Oil protest	https://www.bbc.com/news/articles/cv20p4e1zy5o	original	466	Yes	No	Yes	No	No	No	No	No	No	Yes	Yes	Owe specific	Yes	Yes	pass		
Sky_2023-11-08_Pet-monkey-put	Pet monkey put down on medical advice after mistreatment	https://news.sky.com/story/pet-monkey-put-down-on-medical-advice-after-mistreatment-13003256	original	337	No	Yes	No	No	No	No	No	No	No	No	No	Unused	No	No	no_check		
The-Guardian_2024-05-23_Alarm-as-German	Alarm as German climate activists charged with ‘forming a criminal organisation’	https://www.theguardian.com/environment/article/2024/may/23/alarm-as-german-climate-activists-charged-with-forming-a-criminal-organisation	original	576	Yes	No	Yes	No	No	No	No	No	No	Yes	No	Owe unspecific	Yes	No	no_check		
The-Guardian_2023-11-25_Tom-Allen-At	Tom Allen: ‘At an early corporate gig, they opened the buffet in the middle of my set – everybody left’	https://www.theguardian.com/culture/2023/nov/25/tom-allen-interview	original	569	No	Yes	Yes	No	No	No	No	No	No	No	No	Unused	No	No	no_check		
Metro_None_Penis-size-does-matter	Penis size does matter – but not in the way you think	https://metro.co.uk/2023/11/17/penis-size-matter-not-way-think-19839333/	original	1336	No	Yes	No	No	No	No	No	No	No	No	No	Unused	No	No	no_check		
Mirror_2024-06-20_Just-Stop-Oil-protestors	Just Stop Oil protestors storm airfield 'used by Taylor Swift' and cover planes in orange paint	https://www.mirror.co.uk/news/uk-news/breaking-just-stop-oil-protestors-33064247	original	657	Yes	No	Yes	No	No	No	No	No	No	Yes	Yes	Owe specific	Yes	Yes	pass		
The-Guardian_2024-06-03_May-and-spring-were	May and spring were warmest on record in UK, Met Office says	https://www.theguardian.com/uk-news/article/2024/jun/03/may-spring-warmest-record-uk-met-office	original	520	No	No	No	No	No	No	No	No	No	No	No	Unused	No	No	no_check		
Metro_None_I-havent-seen-my	I haven’t seen my kids in 11 years after my wife took them home with her	https://metro.co.uk/2023/11/15/best-dad-kids-taken-halfway-across-world-19825788/	original	1362	No	Yes	No	No	No	No	No	No	No	No	No	Unused	No	No	no_check		
Metro_None_I-was-in-a	I was in a Channel 4 documentary – what happened next broke my heart	https://metro.co.uk/2023/11/05/i-was-in-a-channel-4-documentary-what-happened-next-broke-my-heart-19761264/	original	1699	No	Yes	No	No	No	No	No	No	No	No	No	Unused	No	No	no_check		
BBC_2025-04-26_Anger-flares-at-Just	Anger flares at Just Stop Oil 'last day of action'	https://www.bbc.com/news/articles/cn7xpxp6xxmo	original	386	Yes	No	Yes	No	No	No	No	No	No	Yes	Yes	Owe specific	Yes	Yes	pass		
The-Guardian_2024-12-07_Dont-dodge-your-responsibilities	‘Don’t dodge your responsibilities,’ Starmer warns English councils that block new homes	https://www.theguardian.com/society/2024/dec/07/starmer-english-councils-new-homes-housing-wildlife-labour	original	890	No	Yes	No	No	No	No	No	No	No	No	No	Unused	No	No	no_check		
The-Guardian_2024-10-29_I-used-to-conserve	I used to conserve artworks. Now I am in prison for taking climate action	https://www.theguardian.com/commentisfree/2024/oct/29/art-climate-action-fossil-fuel-companies	original	934	Yes	No	Yes	No	No	No	No	No	No	Yes	No	Owe unspecific	Yes	No	no_check		
Sky_2023-11-12_Adam-Boulton-Why	Adam Boulton: Why Met Police chief has a firmer grasp on liberal democracy than Suella Braverman	https://news.sky.com/story/adam-boulton-why-met-police-chief-has-a-firmer-grasp-on-liberal-democracy-than-braverman-13004734	original	1459	Yes	No	Yes	No	No	No	No	No	No	No	No	Unused	No	No	no_check		
Metro_None_Theres-more-to-sex	There’s more to sex than having an orgasm – men need to understand that	https://metro.co.uk/2023/10/13/theres-more-to-sex-than-orgasm-men-need-to-understand-that-19659580/	original	1195	No	Yes	No	No	No	No	No	No	No	No	No	Unused	No	No	no_check		
Sky_2024-01-28_Protesters-throw-soup	Protesters throw soup at Mona Lisa painting in Paris	https://news.sky.com/story/protesters-throw-soup-at-mona-lisa-painting-in-paris-13058454	original	419	Yes	No	Yes	No	No	No	No	No	No	Yes	Yes	Owe specific	Yes	Yes	form_issue The summarised article contains a form issue where the opening paragraph is duplicated - it appears both as a subtitle/summary line after the title and then again as the first paragraph of the article body. This creates an awkward repetition that would not be appropriate in a properly formatted news article.		
The-Guardian_2023-12-13_Morning-Mail-Thousands	Morning Mail: Thousands lose millions in crypto schemes, Queensland cyclone aftermath, Bowen hails end of fossil fuels	https://www.theguardian.com/australia-news/2023/dec/14/morning-mail-thousands-lose-millions-in-crypto-schemes-queensland-cyclone-aftermath-bowen-hails-end-of-fossil-fuels	original	1137	No	No	Yes	No	Yes	No	No	No	No	No	No	Unused	No	No	no_check		
The-Guardian_2023-12-12_Lastditch-attempt-to	Last-ditch attempt to forge fresh Cop28 deal after original rejected	https://www.theguardian.com/environment/2023/dec/12/rich-countries-failing-show-leadership-break-cop28-impasse-activists-say	original	1155	No	No	No	No	No	No	No	No	No	No	No	Unused	No	No	no_check		
BBC_2023-10-11_Paint-sprayed-on-Falmouth	Paint sprayed on Falmouth University during protest	https://www.bbc.com/news/articles/czrwmgr4d0ko	original	192	Yes	No	Yes	No	No	No	No	No	No	Yes	Yes	Owe specific	Yes	Yes	no_check		
Sky_2023-12-15_Just-Stop-Oil	Just Stop Oil protester jailed for six months for 'peaceful' march on London's Brent Cross Flyover	https://news.sky.com/story/just-stop-oil-protester-jailed-for-six-months-for-peaceful-march-on-londons-brent-cross-flyover-13030991	original	294	Yes	No	Yes	No	No	No	No	No	No	Yes	Yes	Owe specific	Yes	Yes	no_check		
The-Guardian_None_The-Phoenix-Lewes	The Phoenix, Lewes: a new riverside neighbourhood that sounds almost too good to be true	https://www.theguardian.com/artanddesign/2024/mar/17/the-phoenix-development-lewes-east-sussex-old-ironworks-jonathan-smales-human-nature-expedition-ash-sakula-mae-al-jawad-pike-material-cultures-charles-holland	original	1290	No	Yes	No	No	No	No	No	No	No	No	No	Unused	No	No	no_check		
Metro_None_I-thought-I-could	I thought I could keep my dog safe on Guy Fawkes Night – then he went missing	https://metro.co.uk/2022/11/05/my-dog-ran-away-on-bonfire-night-after-fireworks-scared-him-17686468/	original	1094	No	Yes	No	No	No	No	No	No	No	No	No	Unused	No	No	no_check		
The-Guardian_2024-02-01_Shell-to-raise	Shell to raise dividends again despite 30% fall in annual profits	https://www.theguardian.com/business/2024/feb/01/shell-to-raise-dividends-again-despite-30-fall-in-annual-profits	original	664	No	No	Yes	No	No	No	No	No	No	No	No	Unused	No	No	no_check		
BBC_2025-09-22_Gatwick-second-runway-plan	Gatwick second runway plan approved by transport secretary	https://www.bbc.com/news/articles/c9v7rz24z23o	original	1133	No	No	No	No	No	No	No	No	No	No	No	Unused	No	No	no_check		
The-Guardian_2024-03-24_Children-of-the	Children of the flood: what can lands lost to rising waters tell us?	https://www.theguardian.com/environment/2024/mar/24/children-of-the-flood-what-can-lands-lost-to-rising-waters-tell-us	original	2188	No	No	No	No	No	No	No	No	Yes	No	No	Unused	No	No	no_check		
Metro_None_I-emailed-to-check	I emailed to check whether I would be welcome in church	https://metro.co.uk/2023/12/17/emailed-check-whether-welcome-church-19973244/	original	1782	No	Yes	No	No	No	No	No	No	No	No	No	Unused	No	No	no_check		
The-Guardian_None_From-potholes-to	From potholes to HS2, transport gets voters going – but some solutions are unsayable	https://www.theguardian.com/politics/article/2024/jun/29/transport-labour-tories-potholes-hs2-rail-road-pricing	original	1196	No	No	No	No	No	No	No	No	No	No	No	Unused	No	No	no_check		
The-Guardian_2024-07-08_Labour-lifts-Tories-absurd	Labour lifts Tories’ ‘absurd’ ban on onshore windfarms	https://www.theguardian.com/environment/article/2024/jul/08/labour-lifts-ban-onshore-windfarms-planning-policy	original	721	No	No	No	No	No	No	No	No	No	No	No	Unused	No	No	no_check		
Sky_2023-12-13_Lego-fossil-fuels	Lego, fossil fuels and the COP28 climate deal: What toy bricks tell us about the immense difficulties of going green	https://news.sky.com/story/lego-fossil-fuels-and-the-cop28-climate-deal-what-toy-bricks-tell-us-about-the-immense-difficulties-of-going-green-13029499	original	1297	No	No	Yes	No	No	No	No	No	No	No	No	Unused	No	No	no_check		
The-Times_2025-06-21_Cost-of-damage-by	Cost of damage by Palestine Action could hit £55m	https://www.thetimes.com/uk/crime/article/palestine-action-vandalism-xrcnlpdgh	original	813	No	No	Yes	No	No	No	No	No	No	No	No	Unused	No	No	no_check		
The-Guardian_2024-01-26_Geldof-and-Colman	Geldof and Colman urge Home Office to reconsider climate activist’s deportation	https://www.theguardian.com/environment/2024/jan/26/geldof-coleman-urge-home-office-to-reconsider-climate-activist-marcus-decker-deportation	original	661	Yes	No	Yes	No	No	No	No	No	No	Yes	Yes	Owe specific	Yes	Yes	pass		
Metro_None_I-felt-hopeless-for	I felt hopeless for the LGBTQ+ community – until this Big Brother	https://metro.co.uk/2023/10/11/big-brothers-hallie-has-made-me-feel-safe-for-the-first-time-in-years-19639549/	original	1094	No	Yes	Yes	No	No	No	No	No	No	No	No	Unused	No	No	no_check		
Metro_None_I-was-too-scared	I was too scared to go to the dentist – then all my teeth fell out at 33	https://metro.co.uk/2024/01/14/fear-dentist-made-teeth-crumble-33-spent-17k-fix-20064366/	original	1331	No	Yes	No	No	No	No	No	No	No	No	No	Unused	No	No	no_check		
Mirror_None_Protest-group-behind-viral	Protest group behind viral Jeff Bezos dummy reveal real meaning behind their stunt	https://www.mirror.co.uk/news/politics/protest-group-behind-viral-jeff-35474980	original	561	No	No	Yes	No	No	No	No	No	No	Yes	No	Not even owe	Yes	No	no_check		
BBC_2024-04-06_Greta-Thunberg-Activist-arrested	Greta Thunberg: Activist arrested at Hague climate protest	https://www.bbc.com/news/world-europe-68749936	original	619	Yes	No	Yes	No	No	No	No	No	No	Yes	Yes	Owe specific	Yes	Yes	pass		
BBC_2024-02-12_Reading-Antiwar-and-environmental	Reading: Anti-war and environmental groups protest outside Barclays bank	https://www.bbc.com/news/uk-england-berkshire-68267845	original	292	Yes	No	Yes	No	No	No	No	No	No	No	No	Unused	No	No	no_check		
BBC_2024-01-25_London-mayor-Met-Police	London mayor: Met Police needs more government money	https://www.bbc.com/news/uk-england-london-68079880	original	575	No	No	Yes	No	No	No	No	No	No	No	No	Unused	No	No	no_check		
Sky_2024-07-29_Eight-Just-Stop	Eight Just Stop Oil activists arrested at Gatwick Airport after departure gate protest, Sussex Police say	https://news.sky.com/story/just-stop-oil-activists-block-departure-gates-at-gatwick-airport-13186651	original	352	Yes	No	Yes	No	No	No	No	No	No	Yes	Yes	Owe specific	Yes	Yes	form_issue The summarised article contains problematic elements inappropriate for a news article. Specifically, it ends abruptly without the concluding paragraphs from the original, and more importantly, it removes the final lines that were clearly part of the original news article format: "Keep up with all the latest news from the UK and around the world by following Sky News / Be the first to get Breaking News / Install the Sky News app for free". While removing these promotional elements might seem reasonable, the summary also removes the final substantive news content about the two Just Stop Oil activists found guilty of criminal damage for throwing soup over Van Gogh's Sunflowers painting, which was relevant contextual information that belonged in the news article. Additionally, there appears to be some redundant repetition in the summary where the same information about activists sitting on the floor with lock-on devices is stated twice in slightly different ways.		
The-Times_2025-06-24_Jeff-Bezos-forced-to	Jeff Bezos forced to move wedding party after protests in Venice	https://www.thetimes.com/world/europe/article/jeff-bezos-forced-to-move-wedding-party-after-protests-in-venice-j6qqp3t2j	original	700	No	No	Yes	No	No	No	No	No	No	No	No	Unused	No	No	no_check		
